Predmet	Pitanje	Tip_pitanja	Odgovor_A	Odgovor_B	Odgovor_C	Odgovor_D	Odgovor_E	Odgovor_F	Tocan_odgovor	Napomena	Pregledano	Provjereno
UPS	Iceberg profil govori da bi bilo dobro da je sportaš pun energije a niskih tenzija.	višestruki_izbor	DA	NE					A	Prema izvorima, Iceberg (šiljasti) profil definira se kao prikaz profila ličnosti najuspješnijih sportaša. Ovaj profil odlikuju sljedeće karakteristike: • Visoka razina energije (u grafičkim prikazima označena kao "Vigour"). • Niska razina napetosti (tenzija). • Izostanak ili niska razina negativnih stanja poput depresije, ljutnje, zamora, dileme i konfuzije (zbunjenosti). Stoga je tvrdnja da bi sportaš trebao biti pun energije uz niske tenzije u potpunosti u skladu s opisom Iceberg profila iz priloženih materijala.	TRUE	TRUE
UPS	Najbolje psihološki pripremljen za utakmicu je trener.	višestruki_izbor	DA	NE					A	U izvorima se izričito navodi da je trener taj koji mora biti najbolje psihološki pripremljen za utakmicu. Prema materijalima, ta se pripremljenost očituje kroz trenerovu kontrolu misli, ponašanja i emocija. Također, izvori ističu da djeca uče po modelu, pa se može očekivati da će se igrači ponašati onako kako se ponaša i sam trener. Iz tog razloga, trenerova uloga uključuje ne samo stručnost, već i ulogu pedagoga i motivatorа koji svojim primjerom, strpljenjem i odmjerenom komunikacijom stvara radnu atmosferu.	TRUE	TRUE
UPS	Najbolje je često igračima govoriti ono što se dogodilo.	višestruki_izbor	DA	NE					B	Prema izvorima, preporučuje se izbjegavati često i opširno govorenje o onome što se dogodilo iz sljedećih razloga: • Fokus na budućnost umjesto na prošlost: Karakteristika pozitivnog govora je da se sportašu govori što može učiniti (alternative i buduće akcije), dok se negativni govor fokusira na ono što se ne može učiniti ili na ono što se dogodilo (suptilno optuživanje). • Ograničenje informacija: Trenerima se savjetuje da igračima ne daju previše informacija i uputa jer se kapacitet kratkoročnog pamćenja pod stresom smanjuje. Poruke trebaju biti kratke, a važne stvari treba ponoviti, umjesto opširnog analiziranja prošlih događaja. • Odgađanje analize: Izričito se navodi da analizu utakmice (onoga što se dogodilo) treba odgoditi za drugi dan kako bi se smirile emocije, uz krilaticu "jutro je pametnije od večeri". • Dobni uzrast: U didaktici se ističe da, što su učenici mlađi, to usmeno izlaganje mora biti kraće i razumljivije. Umjesto čestog ponavljanja onoga što se dogodilo, trener bi trebao davati poznate i jasne zadatke prema sposobnostima igrača.	TRUE	TRUE
UPS	Igrače treba stalno upozoravati na ono što bi se moglo dogoditi.	višestruki_izbor	DA	NE					B	Prema izvorima, ovakav pristup komunikaciji nije preporučljiv iz nekoliko ključnih razloga: • Fokus na pozitivne akcije: Karakteristika pozitivnog govora je da se sportašu govori što može učiniti i predlažu mu se moguće alternative, dok se negativni govor fokusira na ono što se ne može učiniti. Stalno upozoravanje na potencijalne opasnosti ili ono što bi se moglo dogoditi može zvučati kao suptilno optuživanje ili zastrašivanje, što nije u skladu s poticanjem i ohrabrivanjem sportaša. • Ograničenost kratkoročnog pamćenja: Kapacitet kratkoročnog pamćenja se pod stresom smanjuje, a davanje previše informacija i uputa igračima može dovesti do preopterećenja. Umjesto stalnog upozoravanja, trener bi trebao skratiti poruku, iznijeti samo ono što je važno i po potrebi to ponoviti. • Jasni i poznati zadaci: Izvori savjetuju da se igračima, naročito neposredno pred utakmicu, daju poznati zadaci usklađeni s njihovim sposobnostima, a ne da ih se opterećuje neizvjesnim scenarijima. • Kratkoća izlaganja: U didaktici sporta naglašava se da usmeno izlaganje mora biti kratko, jasno i razumljivo, a što su učenici mlađi, to ono mora biti kraće. Stalno upozoravanje krši ovaj princip ekonomičnosti komunikacije. Umjesto stalnog upozoravanja na buduće moguće probleme, trener treba biti motivator koji postavlja visoka očekivanja, ali istovremeno povećava samopoštovanje i samopouzdanje igrača.	TRUE	TRUE
UPS	Trener bi koji put mogao nagraditi igrača i mimo pravilnika.	višestruki_izbor	DA	NE					B	Iako se u izvorima spominje citat Johna Maddena koji kaže da trener treba imati što manje pravila kako bi ih igrači manje kršili, u pogledu samog sustava nagrađivanja izvori su vrlo jasni i strogi: • Jasnoća i dosljednost: Izričito se navodi da je za nagrade i kazne potrebno jasno postaviti pravila. • Dosljedna primjena: Trener u korištenju nagrada mora biti dosljedan i pravovremen. Nagrađivanje "mimo pravilnika" izravno narušava princip dosljednosti. • Povjerenje: Jedna od ključnih karakteristika učinkovitog trenera je jasno i dosljedno ponašanje, što gradi povjerenje kod sportaša. Postupanje izvan utvrđenih pravila (mimo pravilnika) može ugroziti to povjerenje. • Fokus na ponašanje: Treba nagraditi ponašanje, a ne osobu, pri čemu je važno jasno reći zbog čega je netko nagrađen. Pravilnik služi upravo tome da se unaprijed zna koja se ponašanja vrednuju. Dakle, prema pedagoškim i psihološkim načelima iz izvora, trener ne bi smio nagrađivati igrače mimo pravilnika, već se mora držati jasno postavljenih pravila i biti dosljedan u njihovoj primjeni.	TRUE	TRUE
UPS	Bolje je više pohvaljivati nego kritizirati.	višestruki_izbor	DA	NE					A	U izvorima se izričito navodi da ljudi više vole pohvale nego kritike te da je bolje davati više pohvala nego kritika. Ovakav pristup temelji se na nekoliko pedagoških i psiholoških principa: • Pozitivan govor: Pohvala je dio pozitivnog govora koji potiče i ohrabruje sportaša, dok kritika često spada u negativan govor koji suptilno optužuje. • Samopoštovanje: Korištenje pohvala i nagrada stvara kod sportaša osjećaj samopoštovanja. • "Sendvič pristup": Čak i kada je kritika nužna, izvori preporučuju njezino "pakiranje" u pozitivne tvrdnje. Prema ovom modelu, prvo se iskazuje pozitivna tvrdnja, zatim uputa za budućnost (konstruktivna kritika), a na kraju ohrabrenje ili kompliment. • Motivacija: Pozitivne povratne informacije, poput pohvala, motiviraju igrače i pomažu u izgradnji njihovog samopouzdanja. Izvori također napominju da pohvala ne bi smjela sadržavati skrivenu kritiku te da može biti izražena i neverbalno, primjerice tapšanjem po ramenu.	TRUE	TRUE
UPS	Empatija je sposobnost uživljavanja u tuđe emocije postupke i razmišljanja.	višestruki_izbor	DA	NE					A	Iako se u izvorima pojam "empatija" ne definira doslovno ovom rečenicom, ta je tvrdnja u potpunosti podržana kroz sljedeće koncepte opisane u materijalima: • Emocionalna inteligencija (EQ): Izvori navode da odgoj u užem smislu uključuje izgrađivanje i oblikovanje ličnosti, što obuhvaća i razvoj EQ-a (emocionalne inteligencije). Empatija je temeljni dio emocionalne inteligencije. • Razumijevanje tuđe pozicije: U uputama za uspješnu komunikaciju, posebno u situacijama ljutnje, izričito se savjetuje: "pokušajte shvatiti poziciju druge osobe". To je izravan opis empatijskog procesa uživljavanja u tuđa razmišljanja i situaciju. • Prepoznavanje emocija: Navodi se da treneri igraju ključnu ulogu u tome da pomažu igračima u prepoznavanju i upravljanju emocijama. Također, ističe se da prepoznavanje vlastitih i tuđih emocija vodi prema boljem upravljanju ponašanjem. • Pedagoška uloga trenera: Dobar trener mora biti pedagog i odgajatelj koji poznaje svoje igrače, njihove sposobnosti i interese. To zahtijeva visoku razinu razumijevanja njihovih postupaka i unutarnjih stanja kako bi se stvorila radna atmosfera i pružio pozitivan uzor. Zaključno, sposobnost uživljavanja u tuđe emocije i razmišljanja (empatija) predstavlja ključnu vještinu u okviru psihološke pripreme i uspješne komunikacije koju izvori promiču kao nužnu za učinkovito treniranje.	TRUE	TRUE
UPS	Motivi za samopostovanjem i ugledom su urođeni biološki motivi.	višestruki_izbor	DA	NE					B	Prema izvorima, tvrdnja da su motivi za samopoštovanjem i ugledom urođeni biološki motivi je netočna zbog sljedeće klasifikacije: • Biološki motivi definiraju se kao urođeni ili primarni motivi, a uključuju potrebe za hranom i pićem, seksom, kretanjem, izbjegavanjem boli, odmorom i snom. • Motivi za samopoštovanjem i ugledom ubrajaju se u socijalne, stečene ili sekundarne motive. U ovu skupinu također spadaju motivi za društvom, sigurnošću, moći, samostalnošću i stvaralaštvom. Dakle, budući da se samopoštovanje i ugled stječu kroz socijalizaciju i iskustvo, a ne nasljeđuju biološki, ponuđeni odgovor pod B (NE) je ispravan.	TRUE	TRUE
UPS	Bolje je da su kod igrača izraženiji vanjski ekstrinzični motivi.	višestruki_izbor	DA	NE					B	Prema izvorima, ovakva tvrdnja je netočna iz sljedećih razloga: • Podjela motiva: Motivi se dijele na ekstrinzične (vanjske), koji uključuju pobjedu, nagrade i želju da se razvesele drugi, te na intrinzične (unutarnje) motive. • Važnost unutarnje motivacije: Intrinzični motivi, poput usavršavanja novih znanja i vještina, osobnog doprinosa te uživanja u samoj igri, ključni su za dugoročni razvoj sportaša. • Uloga trenera: Učinkovit trener trebao bi biti motivator na aktivnost i učenje. Cilj psihološke pripreme je optimalizacija osobne motivacije i povećanje samopoštovanja, što se lakše postiže kada sportaš crpi snagu iz unutarnjih razloga, a ne samo iz vanjskih pritisaka ili nagrada. • Rizik od "izgaranja": Iako je motiv za postignućem važan za natjecanje, izvori upozoravaju da igrač može "izgorjeti u želji" ako su ti motivi previsoki ili loše usmjereni. Stoga je pedagoški i psihološki poželjnije da su kod sportaša, osobito kod djece, jače izraženi intrinzični motivi nego vanjski (ekstrinzični).	TRUE	TRUE
UPS	Prevelika motivacija može smanjiti učinak.	višestruki_izbor	DA	NE					A	U izvorima se navodi da je odnos između motivacije i uspjeha specifičan te da motivacija ne bi trebala prelaziti optimalnu granicu: • Rizik od "izgaranja": Iako je motiv za postignućem nužan za sportski uspjeh, izvori izričito upozoravaju da ako je taj motiv previsok, sportaš bi mogao "izgorjeti u želji" da bude uspješan. • Negativne emocije: Strast prema sportu je snažan motivator, ali ako postane preintenzivna, može izazvati bijes, razočaranje i frustraciju, osobito kada ta velika želja ne rezultira trenutnim uspjehom. • Narušavanje izvedbe: Prevelik pritisak i previsoka motivacija mogu dovesti do nesportskog ponašanja i narušavanja timske kemije, što u konačnici smanjuje učinak na terenu. Stoga, unatoč tome što je motivacija ključna za postizanje rezultata, njezina ekstremna razina može biti kontraproduktivna i negativno utjecati na sportsku izvedbu.	TRUE	TRUE
UPS	Igrač dok igra treba razmišljati o onome što se dogodilo i što će biti na kraju utakmice.	višestruki_izbor	DA	NE					B	Prema izvorima, ovakav način razmišljanja tijekom igre bio bi kontraproduktivan za sportsku izvedbu iz sljedećih razloga: • Usmjeravanje pažnje i koncentracija: Pažnja se definira kao usredotočivanje psihičke energije na određeni objekt. Tijekom igre, sportaš mora imati usku ili široku pažnju usmjerenu na relevantne podražaje (poput lopte, suigrača ili protivnika), a razmišljanje o prošlosti ili budućem ishodu utakmice predstavlja distrakciju koja ometa taj fokus. • Fokus na proces umjesto na ishod: Razmišljanje o tome "što će biti na kraju utakmice" (cilj) može omesti instrumentalno ponašanje (trud, suradnju i pridržavanje uputa) koje je nužno za postizanje tog cilja. • Odgađanje analize: Izvori izričito savjetuju da se analiza onoga što se dogodilo na utakmici odgodi za drugi dan. Razmišljanje o pogreškama ili prošlim događajima dok utakmica još traje može izazvati negativne emocije i stres, što smanjuje učinak na terenu. • Karakteristike pozitivnog govora: Pozitivan pristup fokusira se na ono što se može učiniti sada i predlaže alternative, dok se bavljenje onime što se dogodilo (prošlost) često pretvara u suptilno optuživanje ili analizu onoga što se više ne može promijeniti. • Psihološka priprema: Jedan od ključnih ciljeva psihološke pripreme je povećanje sposobnosti koncentracije i pažnje na trenutni zadatak kako bi se postigla optimalna stabilnost i kvaliteta izvedbe. Zaključno, igrač bi tijekom igre trebao biti fokusiran isključivo na trenutne zadatke i akcije, dok analizu prošlosti i razmišljanje o krajnjem rezultatu treba ostaviti za razdoblje nakon utakmice.	TRUE	TRUE
UPS	Bolje je u utakmici biti usmjeren na zadatak nego na posljedicu.	višestruki_izbor	DA	NE					A	Usmjerenost na zadatak (proces) smatra se učinkovitijom od usmjerenosti na samu posljedicu (ishod ili rezultat) na temelju nekoliko ključnih koncepata iz izvora: • Instrumentalno ponašanje: Prema motivacijskom ciklusu, da bi se postigao cilj (posljedica), sportaš mora provoditi instrumentalno ponašanje, što uključuje marljivo treniranje, suradnju s igračima i slušanje uputa trenera. Fokus na te konkretne zadatke je ono što vodi do uspjeha. • Pažnja i koncentracija: Kvalitetna izvedba zahtijeva usmjeravanje psihičke energije na relevantne podražaje u okolini. Razmišljanje o posljedicama utakmice dok ona još traje može biti distrakcija koja odvlači pažnju s terena. • Izbjegavanje "izgaranja": Izvori upozoravaju da ako je motiv za postignućem (ishodom) previsok, sportaš može "izgorjeti u želji" da bude uspješan, što negativno utječe na učinak. • Stilovi vođenja: Učinkovit vođa je često orijentiran na zadatak, što podrazumijeva fokus na aktivnosti za ostvarivanje ciljeva i definiranje odgovornosti. Također, principijelni (asertivni) stil komunikacije usmjeren je na rješavanje problema i postizanje rezultata na učinkovit način, umjesto isključive usmjerenosti na pobjedu kao jedini cilj. • Psihološka priprema: Jedan od ciljeva mentalne pripreme je povećanje sposobnosti koncentracije i pažnje na trenutne zadatke kako bi se osigurala stabilnost i kvaliteta izvedbe. Zaključno, usmjerenost na zadatak omogućuje sportašu da ostane u trenutku i kontrolira elemente igre koji su pod njegovim utjecajem, dok pretjerana usmjerenost na posljedicu može povećati stres i anksioznost.	TRUE	TRUE
UPS	Igrač bi se trebao uspoređivati sa drugim igračima da bi napredovao.	višestruki_izbor	DA	NE					B	Iako je natjecanje sastavni dio sporta, izvori naglašavaju da stalno uspoređivanje s drugima nije najbolji put za napredak iz sljedećih razloga: • Izvor negativnih emocija: U izvorima se izričito navodi da uspoređivanje s uspješnijim kolegama može voditi do sukoba, ljubomore i frustracije. Intenzitet natjecanja sam po sebi stvara stres, a fokus na druge može povećati ljutnju i narušiti timsku kemiju. • Važnost intrinzične motivacije: Za dugoročni napredak i razvoj vještina ključni su intrinzični (unutarnji) motivi, kao što su usavršavanje novih znanja i vještina te osobni doprinos i uspjeh. Napredak bi trebao proizaći iz želje za ovladavanjem vještinom, a ne samo iz pobjede nad drugima. • Usmjerenost na zadatak, a ne na ishod: Kao što smo vidjeli u prethodnim odgovorima, bolji se učinak postiže kada je sportaš usmjeren na zadatke i proces (instrumentalno ponašanje), a ne na ishod ili društveni status u odnosu na druge. Potreba za postignućem definira se kao dostizanje ili premašivanje određenog standarda kvalitete, što može biti i osobni standard, a ne nužno pobjeda nad drugom osobom. • Individualizacija rada: Jedan od temeljnih pedagoških principa je individualni pristup. Odgojni rad i planovi treninga trebaju se bazirati na individualnim sposobnostima svakog djeteta, jer je svaki sportaš jedinstvena i neponovljiva pojava. Zaključno, umjesto uspoređivanja s drugima, sportaš bi se trebao fokusirati na vlastiti proces učenja, savladavanje motoričkih zadaća i postizanje optimalne razine samopouzdanja kroz vlastiti trud i napredak.	TRUE	TRUE
UPS	Igrači sa izraženijim motivom za izbjegavanje neuspjeha igraju bolje kad je rezultat izvjestan.	višestruki_izbor	DA	NE					A	Iako se u izvorima ova specifična rečenica ne pojavljuje u doslovnom obliku, ona je izravno povezana s konceptima motiva za postignućem i anksioznosti koji su detaljno opisani u materijalima: • Potreba za postignućem i strah od neuspjeha: Izvori definiraju potrebu za postignućem kao težnju ka dostizanju ili premašivanju određenog standarda kvalitete u situacijama natjecanja. Igrači kod kojih dominira motiv za izbjegavanje neuspjeha često doživljavaju anksioznost — negativno emocionalno stanje praćeno strahom, tremom i zabrinutošću. • Utjecaj izvjesnosti rezultata: Prema psihološkim teorijama na kojima se temelje ovi materijali (iako su u izvorima navedeni samo osnovni pojmovi), sportaši s visokim strahom od neuspjeha osjećaju manji pritisak kada je ishod utakmice izvjestan (bilo da je pobjeda sigurna ili je poraz neizbježan). U takvim situacijama rizik od osobne odgovornosti za neuspjeh je smanjen, što im omogućuje da igraju s manje mišićne tenzije i negativnog samogovora, koji su inače simptomi stresa. • Optimalno samopouzdanje: Izvori navode da je optimalna razina samopouzdanja povezana s najvišom razinom učinka. Kod igrača koji se boje neuspjeha, neizvjestan rezultat može izazvati previsoku razinu uzbuđenja i "izgaranje u želji", što narušava njihovu izvedbu. Informacija o tome da sportaši s motivom za izbjegavanje neuspjeha biraju situacije u kojima je ishod izvjestan (vrlo lake ili vrlo teške zadatke) predstavlja standardni dio sportske psihologije (Atkinsonov model), koji se nadovezuje na definicije motiva i stresa navedene u izvorima. Možete neovisno provjeriti taj specifični model radi dodatne sigurnosti.	TRUE	TRUE
UPS	Motivacijskim ciklusom objašnjava se kako dolazi do nečijeg ponašanja.	višestruki_izbor	DA	NE					A	U izvorima se izričito navodi da se motivacijskim ciklusom objašnjava kako dolazi do nekog ponašanja. Prema dostupnim materijalima, ovaj proces funkcionira na sljedeći način: • Početak ciklusa: Sve započinje zadavanjem određenog cilja, koji u sportašu budi odgovarajući motiv za njegovo ostvarenje. • Instrumentalno ponašanje: Kako bi postigao taj cilj, sportaš poduzima konkretne akcije, što se naziva instrumentalno ponašanje (npr. marljivo treniranje, suradnja s drugim igračima i slušanje trenerovih uputa). • Prepreke (barijere): Tijekom tog procesa često se pojavljuju barijere, poput ozljeda, koje sportaš mora prevladati kako bi nastavio napredovati prema cilju. Izvori definiraju motive kao uzroke ljudskog ponašanja te ističu da je nečije ponašanje u svakom trenutku određeno velikim brojem motiva koji se nalaze u međusobnim složenim odnosima. S obzirom na to da motivacija predstavlja usmjerenost, intenzitet i ustrajnost ponašanja, razumijevanje ovog ciklusa ključno je za trenera kako bi mogao učinkovito poticati sportaše na aktivnost i učenje.	TRUE	TRUE
UPS	Roditelji više smetaju nego što koriste mladom igraču.	višestruki_izbor	DA	NE					B	Iako izvori priznaju da odnos s roditeljima može biti kompliciran, oni roditelje vide kao neizostavan i koristan dio sportskog procesa, a ne kao prvenstvenu smetnju. Evo ključnih razloga temeljenih na izvorima: • Sportski trokut: Roditelji su uz trenera i sportaša jedan od tri ključna vrha "sportskog trokuta" suradnje. Navodi se da su oni "od izuzetne važnosti za uspjeh u sportu". • Uloga podrške: Roditelji su opisani kao "uzor djeci i podrška kroz svakodnevnicu". Njihov odnos s djetetom može "uvelike pozitivno doprinijeti sportskom razvoju". • Vrijedan izvor informacija: Izvori ističu da je roditelj za trenera "vrijedan izvor informacija" i da posjeduje veliku moć koju treba usmjeriti na dobrobit djeteta. • Problem je samo u "pretjeranoj uključenosti": Tek se za "pretjerano uključenog roditelja" navodi da stvara najviše poteškoća jer može biti previše zaštitnički nastrojen i ometati odnos trenera i sportaša. To se, dakle, odnosi na specifičan tip ponašanja, a ne na roditelje općenito. • Cilj je suradnja, a ne eliminacija: Zaključak izvora je da treba održavati otvorenu komunikaciju u odnosu trener–roditelj kako bi se spriječili negativni utjecaji, što potvrđuje da se roditelji smatraju partnerima u razvoju mladog sportaša. Stoga je tvrdnja da roditelji "više smetaju nego što koriste" u suprotnosti s pedagoškim modelom suradnje i važnosti koju izvori pridaju roditeljima kao potpori.	TRUE	TRUE
UPS	Dijete je „Čovjek u malom“.	višestruki_izbor	DA	NE					B	Prema izvorima, tvrdnja da je dijete „čovjek u malom“ predstavlja zastarjelo shvaćanje koje je moderna znanost odbacila: • Napuštena pretpostavka: U izvorima se izričito navodi da se nekada vjerovalo da je „dijete čovjek u malome“, ali su danas takve pretpostavke napuštene. • Osnovne razlike u ličnosti: Izvori ističu da postoje temeljne razlike u ličnosti između odraslog čovjeka i djeteta. Te se razlike očituju u:     ◦ mehanizmima kontrole agresivnosti,     ◦ načinu reagiranja na frustracije,     ◦ sposobnosti razumijevanja,     ◦ razini samostalnosti. • Specifičnosti razvoja: Razvoj djeteta prati se kroz različita životna razdoblja (srednje i kasno djetinjstvo, pubertet, adolescencija), od kojih svako ima svoje kognitivne i emocionalne specifičnosti, poput prijelaza iz faze konkretnih u fazu formalnih operacija. Dakle, suvremena razvojna psihologija, na koju se izvori pozivaju, dijete promatra kao biće u razvoju s vlastitim specifičnostima, a ne kao umanjenu verziju odrasle osobe.	TRUE	TRUE
UPS	Nasljeđe je najbitnije kod razvoja djeteta.	višestruki_izbor	DA	NE					B	Ponuđena tvrdnja da je nasljeđe najbitnije za razvoj djeteta zastarjelo je shvaćanje koje izvori opovrgavaju na sljedeći način: • Napuštene pretpostavke: U izvorima se izričito navodi da su pretpostavke poput one da je "nasljeđe mnogo važnije od okoline u formiranju ličnosti" danas u potpunosti napuštene. • Povijesni kontekst (Pedagoški pesimizam): Shvaćanje da je čovjek isključivo produkt nasljeđa (nativizam) bilo je karakteristično za 19. stoljeće, kada se vjerovalo da djeca nasljeđuju čak i "grijehe svojih predaka", što se naziva pedagoškim pesimizmom. • Teorija konvergencije: Psiholog W. Stern postavio je teoriju prema kojoj na razvoj utječu i nasljeđe i okolina zajedno. • Suvremeno shvaćanje (Formula razvoja): Prema modernoj znanosti, razvoj djeteta (R) rezultat je interakcije triju ključnih čimbenika: nasljeđa (N), okoline (O) i aktivnosti samog pojedinca (JA). • Dokazi iz prakse:     ◦ Primjer djeteta (Donalda) i majmuna (Gua) koji su odgajani zajedno pokazuje da samo odgoj nije dovoljan ako ne postoji ljudsko nasljeđe (majmun nije progovorio).     ◦ S druge strane, primjer "djece vukova" (Amala i Kamala) pokazuje da samo nasljeđe nije dovoljno ako izostane ljudska okolina i odgoj (djeca nisu mogla uspravno hodati niti govoriti). Zaključno, razvoj je kompleksan proces u kojem niti jedan čimbenik nije "najbitniji" sam za sebe, već djeluju u stalnoj međusobnoj povezanosti.	TRUE	TRUE
UPS	Igrač osjeća veći pritisak ako nešto mora nego ako nešto želi postići.	višestruki_izbor	DA	NE					A	Ova tvrdnja temelji se na razlikovanju između unutarnje motivacije i vanjskih pritisaka koji su opisani u izvorima: • Ekstrinzični (vanjski) motivi vs. Intrinzični (unutarnji) motivi: Izvori dijele motive na ekstrinzične, poput nagrada, pobjeda ili želje da se razvesele drugi, te na intrinzične, koji uključuju uživanje u igri i osobni doprinos. Kada igrač osjeća da nešto "mora", on je pod utjecajem vanjskih faktora i očekivanja okoline, što se u psihologiji sporta izravno povezuje s povećanim pritiskom. • Definicija stresa: Stres se u izvorima definira kao stanje neravnoteže koje nastaje uslijed percipiranog zahtjeva okoline. Osjećaj da se nešto "mora" predstavlja upravo takav zahtjev (percipirani pritisak), koji može izazvati simptome poput anksioznosti, negativnog samogovora i povećane mišićne tenzije. • Micanje pritiska: Upute za komunikaciju prije natjecanja izričito navode da je jedna od zadaća trenera "micanje pritiska" i ohrabrivanje. To se postiže fokusiranjem na ono što igrač može i želi (pozitivan govor i ohrabrenje), umjesto na obveze i imperativ pobjede (negativan govor koji suptilno optužuje). • Izgaranje u želji: Iako visoka želja ("želi postići") može dovesti do toga da igrač "izgori u želji" ako je motivacija previsoka, izvori sugeriraju da je taj osjećaj ipak različit od nametnutog pritiska ("mora") koji narušava funkcionalnost i izaziva anksioznost. Dakle, prema izvorima, osjećaj "moranja" je ekstrinzični zahtjev koji pojačava pritisak i stres, dok je "želja za postizanjem" povezana s unutarnjom motivacijom koja je pedagoški poželjnija za stabilnost i kvalitetu izvedbe.	TRUE	TRUE
